{
  "$schema": "https://json-schema.org/draft/2020-12/schema",
  "$id": "ccna-racing/questions.schema.json",
  "title": "CCNA Question Pool",
  "type": "array",
  "minItems": 1,
  "items": {
    "type": "object",
    "additionalProperties": false,
    "required": ["id", "topic", "difficulty", "prompt", "options", "correctIndex", "explanation", "source"],
    "properties": {
      "id": { "type": "string", "minLength": 1 },
      "topic": {
        "type": "string",
        "enum": ["subnetting", "routing", "switching", "osi-tcpip", "protocols", "security"]
      },
      "difficulty": { "type": "string", "enum": ["easy", "medium", "hard"] },
      "prompt": { "type": "string", "minLength": 1 },
      "options": {
        "type": "array",
        "minItems": 4,
        "maxItems": 4,
        "uniqueItems": true,
        "items": { "type": "string", "minLength": 1 }
      },
      "correctIndex": { "type": "integer", "minimum": 0, "maximum": 3 },
      "explanation": { "type": "string", "minLength": 1 },
      "source": { "type": "string", "minLength": 1 }
    }
  }
}
